{"contract_version":"v1","definition_id":"definition_v1_01J8Q3Z4R5T6V7W8X9Y0ABCDEF","workflow_id":"workflow_v1_01J8Q3Z4R5T6V7W8X9Y0ABCDEF","request_id":"request_v1_01J8Q3Z4R5T6V7W8X9Y0ABCDEF","task_ref":"task_v1_01J8Q3Z4R5T6V7W8X9Y0ABCDEF","project_ref":"project_v1_01J8Q3Z4R5T6V7W8X9Y0ABCDEF","trace_id":"trace_v1_01J8Q3Z4R5T6V7W8X9Y0ABCDEF","workflow_version":3,"revision":5,"lifecycle":"active","definition_hash":"sha256:aaaaaaaaaaaaaaaaaaaaaaaaaaaaaaaaaaaaaaaaaaaaaaaaaaaaaaaaaaaaaaaa","workflow_artifact_ref":"artifact_v1_01J8Q3Z4R5T6V7W8X9Y0ABCDEF","evidence_refs":["evidence_v1_01J8Q3Z4R5T6V7W8X9Y0ABCDEF"],"declared_trigger_class":"manual","capability_refs":["capability_v1_01J8Q3Z4R5T6V7W8X9Y0ABCDEF"],"approval_ref":"approval_v1_01J8Q3Z4R5T6V7W8X9Y0ABCDEF"}
